<?xml version="1.0" encoding="utf-8"?>
<!DOCTYPE reviews SYSTEM "../validation/reviews.dtd">
<reviews>
  <review id="review1">
    <place>The Diner</place>
    <author>Alex C.</author>
    <rating>4</rating>
    <date>2025-10-01</date>
    <summary>Classic breakfast with friendly staff.</summary>
    <content>Great pancakes and fast service. Cozy atmosphere.</content>
  </review>
  <review id="review2">
    <place>Pasta House</place>
    <author>Seth M.</author>
    <rating>5</rating>
    <date>2025-10-05</date>
    <summary>Amazing pasta and wine selection.</summary>
    <content>Beautiful presentation and authentic flavors. Highly recommend the carbonara.</content>
  </review>
</reviews>
